Authors,Author(s) ID,Title,Year,Source title,Volume,Issue,Art. No.,Page start,Page end,Page count,Cited by,DOI,Link,Affiliations,Authors with affiliations,Abstract,Author Keywords,Document Type,Publication Stage,Access Type,Source,EID
"Russell R.E., Royle J.A., Saab V.A., Lehmkuhl J.F., Block W.M., Sauer J.R.","7403934131;7005951931;6603192299;6701335103;7102483717;16182360600;","Modeling the effects of environmental disturbance on wildlife communities: Avian responses to prescribed fire",2009,"Ecological Applications","19","5",,"1253","1263",,84,"10.1890/08-0910.1","https://www.scopus.com/inward/record.uri?eid=2-s2.0-68149147597&doi=10.1890%2f08-0910.1&partnerID=40&md5=d58f15a71c6b09b4d4340a89ba28f709","U.S. Forest Service, Rocky Mountain Research Station, Montana State University Campus, 1648 S. 7th Avenue, Bozeman, MT 59717, United States; USGS Patuxent Wildlife Research Center, 12100 Beech Forest Road, Laurel, MD 20708, United States; U.S. Forest Service, Pacific Northwest Research Station, 1133 N. Western Avenue, Wenatchee, WA 98801, United States; U.S. Forest Service, Rocky Mountain Research Station, Southwest Forest Science Complex, 2500 South Pine Knoll Drive, Flagstaff, AZ 86001, United States; Montana Fish, Wildlife, and Parks, Wildlife Division, 1400 South 19th Avenue, Bozeman, MT 59718, United States","Russell, R.E., U.S. Forest Service, Rocky Mountain Research Station, Montana State University Campus, 1648 S. 7th Avenue, Bozeman, MT 59717, United States, Montana Fish, Wildlife, and Parks, Wildlife Division, 1400 South 19th Avenue, Bozeman, MT 59718, United States; Royle, J.A., USGS Patuxent Wildlife Research Center, 12100 Beech Forest Road, Laurel, MD 20708, United States; Saab, V.A., U.S. Forest Service, Rocky Mountain Research Station, Montana State University Campus, 1648 S. 7th Avenue, Bozeman, MT 59717, United States; Lehmkuhl, J.F., U.S. Forest Service, Pacific Northwest Research Station, 1133 N. Western Avenue, Wenatchee, WA 98801, United States; Block, W.M., U.S. Forest Service, Rocky Mountain Research Station, Southwest Forest Science Complex, 2500 South Pine Knoll Drive, Flagstaff, AZ 86001, United States; Sauer, J.R., USGS Patuxent Wildlife Research Center, 12100 Beech Forest Road, Laurel, MD 20708, United States","Prescribed fire is a management tool used to reduce fuel loads on public lands in forested areas in the western United States. Identifying the impacts of prescribed fire on bird communities in ponderosa pine (Pinus ponderosa) forests is necessary for providing land management agencies with information regarding the effects of fuel reduction on sensitive, threatened, and migratory bird species. Recent developments in occupancy modeling have established a framework for quantifying the impacts of management practices on wildlife community dynamics. We describe a Bayesian hierarchical model of multi-species occupancy accounting for detection probability, and we demonstrate the model's usefulness for identifying effects of habitat disturbances on wildlife communities. Advantages to using the model include the ability to estimate the effects of environmental impacts on rare or elusive species, the intuitive nature of the modeling, the incorporation of detection probability, the estimation of parameter uncertainty, the flexibility of the model to suit a variety of experimental designs, and the composite estimate of the response that applies to the collection of observed species as opposed to merely a small subset of common species. Our modeling of the impacts of prescribed fire on avian communities in a ponderosa pine forest in Washington indicate that prescribed fire treatments result in increased occupancy rates for several bark-insectivore, cavity-nesting species including a management species of interest, Black-backed Woodpeckers (Picoides arcticus). Three aerial insectivore species, and the ground insectivore, American Robin (Turdus migratorius), also responded positively to prescribed fire, whereas three foliage insectivores and two seed specialists, Clark's Nutcracker (Nucifraga columbiana) and the Pine Siskin (Carduelis pinus), declined following treatments. Land management agencies interested in determining the effects of habitat manipulations on wildlife communities can use these methods to provide guidance for future management activities. © 2009 by the Ecological Society of America.","Composite analysis; Fuel treatments; Hierarchical Bayes; Point count survey; Ponderosa pine; Presence-absence data; Species richness; WinBUGS",Article,"Final",,Scopus,2-s2.0-68149147597
"Nappi A., Drapeau P.","7006191666;7005856982;","Reproductive success of the black-backed woodpecker (Picoides arcticus) in burned boreal forests: Are burns source habitats?",2009,"Biological Conservation","142","7",,"1381","1391",,65,"10.1016/j.biocon.2009.01.022","https://www.scopus.com/inward/record.uri?eid=2-s2.0-67349284072&doi=10.1016%2fj.biocon.2009.01.022&partnerID=40&md5=2375007dd7ff2effe463a0b9460f7171","Centre for Forest Research, Département des sciences biologiques, Université du Québec à Montréal, C.P. 8888, Succ. Centre-ville, Montréal, Que. H3C 3P8, Canada","Nappi, A., Centre for Forest Research, Département des sciences biologiques, Université du Québec à Montréal, C.P. 8888, Succ. Centre-ville, Montréal, Que. H3C 3P8, Canada; Drapeau, P., Centre for Forest Research, Département des sciences biologiques, Université du Québec à Montréal, C.P. 8888, Succ. Centre-ville, Montréal, Que. H3C 3P8, Canada","The black-backed woodpecker (Picoides arcticus) is considered a fire specialist throughout its breeding range. Given its high abundance in recent burns, it has been hypothesized that post-fire forests are source habitats for this species. We conducted a 3-year post-fire study to evaluate the temporal occupancy and reproductive success of black-backed woodpeckers in high-severity burned black spruce forests of central Quebec, Canada. We examined how reproductive success varied temporally and spatially within a burned landscape and investigated the potential source or sink status of this woodpecker population over time. Woodpecker nest density was high in the year after fire but declined significantly over the 3-year period. Based on 106 nests, nest success declined from 84% the first year after fire to 73% and 25%, respectively, for the second and third years after fire. Nest density and reproductive success were higher in areas with high proportions of burned mature forests than in areas dominated by burned young forests. Reproductive success was also higher in proximity to unburned forests. Comparison of annual productivity with a range of survival estimates indicated that these burned forests likely functioned as source habitats for the first 2 years following fire, although this status varied as a function of pre-fire forest age. Our results suggest that post-fire forests may contribute significantly to population levels in fire-prone ecosystems. Forest management practices that reduce the amount of mature and over-mature forests can affect the quality of post-fire habitats important to the black-backed woodpecker and other fire-associated species. © 2009 Elsevier Ltd. All rights reserved.","Birds; Dead wood; Fire; Nest success; Picidae; Source-sink",Article,"Final",,Scopus,2-s2.0-67349284072
"Dickson B.G., Noon B.R., Flather C.H., Jentsch S., Block W.M.","8516206500;7003488778;7004609751;35923504400;7102483717;","Quantifying the multi-scale response of avifauna to prescribed fire experiments in the southwest United States",2009,"Ecological Applications","19","3",,"608","621",,26,"10.1890/08-0905.1","https://www.scopus.com/inward/record.uri?eid=2-s2.0-65349099353&doi=10.1890%2f08-0905.1&partnerID=40&md5=5a71c87b76dee020983725289e29c405","Department of Fish, Wildlife, and Conservation Biology, Colorado State University, Fort Collins, CO 80523, United States; USDA Forest Service, Rocky Mountain Research Station, 2500 South Pine Knoll Drive, Flagstaff, AZ 86001, United States; USDA Forest Service, Rocky Mountain Research Station, 2150-A Centre Ave., Fort Collins, CO 80526, United States; School of Natural Resources, University of Arizona, Tucson, AZ 85721, United States; Center for Sustainable Environments, Northern Arizona University, Flagstaff, AZ 86011-5694, United States","Dickson, B.G., Department of Fish, Wildlife, and Conservation Biology, Colorado State University, Fort Collins, CO 80523, United States, USDA Forest Service, Rocky Mountain Research Station, 2500 South Pine Knoll Drive, Flagstaff, AZ 86001, United States, Center for Sustainable Environments, Northern Arizona University, Flagstaff, AZ 86011-5694, United States; Noon, B.R., Department of Fish, Wildlife, and Conservation Biology, Colorado State University, Fort Collins, CO 80523, United States; Flather, C.H., USDA Forest Service, Rocky Mountain Research Station, 2150-A Centre Ave., Fort Collins, CO 80526, United States; Jentsch, S., School of Natural Resources, University of Arizona, Tucson, AZ 85721, United States; Block, W.M., USDA Forest Service, Rocky Mountain Research Station, 2500 South Pine Knoll Drive, Flagstaff, AZ 86001, United States","Landscape-scale disturbance events, including ecological restoration and fuel reduction activities, can modify habitat and affect relationships between species and their environment. To reduce the risk of uncharacteristic stand-replacing fires in the southwestern United States, land managers are implementing restoration and fuels treatments (e.g., mechanical thinning, prescribed fire) in progressively larger stands of dry, lower elevation ponderosa pine (Pinus ponderosa) forest. We used a Before-After/Control-Impact experimental design to quantify the multi-scale response of avifauna to large (;250-400 ha) prescribed fire treatments on four sites in Arizona and New Mexico dominated by ponderosa pine. Using distance sampling and an information-theoretic approach, we estimated changes in density for 14 bird species detected before (May-June 2002-2003) and after (May-June 2004-2005) prescribed fire treatments. We observed few site-level differences in pre- and posttreatment density, and no species responded strongly to treatment on all four sites. Pointlevel spatial models of individual species response to treatment, habitat variables, and fire severity revealed ecological relationships that were more easily interpreted. At this scale, pretreatment forest structure and patch characteristics were important predictors of posttreatment differences in bird species density. Five species (Pygmy Nuthatch [Sitta pygmaea], Western Bluebird [Sialia mexicana], Steller's Jay [Cyanocitta stelleri ], American Robin [Turdus migratorius], and Hairy Woodpecker [Picoides villosus]) exhibited a strong treatment response, and two of these species (American Robin and Hairy Woodpecker) could be associated with meaningful fire severity response functions. The avifaunal response patterns that we observed were not always consistent with those reported by more common studies of wildland fire events. Our results suggest that, in the short term, the distribution and abundance of common members of the breeding bird community in Southwestern ponderosa pine forests appear to be tolerant of low- to moderate-intensity prescribed fire treatments at multiple spatial scales and across multiple geographic locations. © 2009 by the Ecological Society of America.","BACI design; Birds; Density; Distance sampling; Fire severity; Forest structure; Fuel reduction treatments; Model selection; Ponderosa pine; Prescribed fire; Restoration; Scale",Article,"Final",,Scopus,2-s2.0-65349099353
"Vierling K.T., Gentry D.J., Haines A.M.","6602257928;12241373000;7103103480;","Nest niche partitioning of Lewis's and red-headed woodpeckers in burned pine forests",2009,"Wilson Journal of Ornithology","121","1",,"89","96",,7,"10.1676/07-184.1","https://www.scopus.com/inward/record.uri?eid=2-s2.0-62549127844&doi=10.1676%2f07-184.1&partnerID=40&md5=34c31e490ef8ffee7899d467204f78b9","Department of Fish and Wildlife, University of Idaho, P. O. Box 441136, Moscow, ID 83844, United States; South Dakota School of Mines and Technology, 501 East Saint Joseph Street, Rapid City, SD 57701, United States; Center for Research on Invasive Species and Small Populations, University of Idaho, P. O. Box 441141, Moscow, ID 83844, United States; Teton Science Schools, 700 Coyote Canyon Road, Jackson, WY 83001, United States; Upper Iowa University, Division of Science and Mathematics, P. O. Box 1857, 605 Washington Street, Fayette, IA 52142, United States","Vierling, K.T., Department of Fish and Wildlife, University of Idaho, P. O. Box 441136, Moscow, ID 83844, United States; Gentry, D.J., South Dakota School of Mines and Technology, 501 East Saint Joseph Street, Rapid City, SD 57701, United States, Teton Science Schools, 700 Coyote Canyon Road, Jackson, WY 83001, United States; Haines, A.M., Center for Research on Invasive Species and Small Populations, University of Idaho, P. O. Box 441141, Moscow, ID 83844, United States, Upper Iowa University, Division of Science and Mathematics, P. O. Box 1857, 605 Washington Street, Fayette, IA 52142, United States","Lewis's (Melanerpes lewis) and Red-headed Woodpecker (Melanerpes erythrocephalus) breeding ranges overlap slightly, but co-occurrence within habitats is thought to be rare because of niche similarity. Our objectives were to examine factors that allowed for co-existence in two burned pine (Pinus ponderosa) forests in the Black Hills, South Dakota. We monitored 53 Lewis's and 38 Red-headed Woodpecker nests between 2002 and 2005, and compared clutch initiation dates and nest-site selection. Clutch initiation dates did not differ between species for 3 of 4 years. We compared multiple habitat factors surrounding nests of the two species, and only tree and snag densities differed between Red-headed Woodpecker nest sites (65.1 ± 5.78 stems/ha) and those of Lewis's Woodpeckers (48.5 ± 6.06 stems/ha). These results are consistent with the foraging techniques used by the two species. We suggest that habitat partitioning is an important mechanism of coexistence for these two species, but also recommend further research on their foraging strategies.",,Article,"Final",,Scopus,2-s2.0-62549127844
"Cahall R.E., Hayes J.P.","25929870500;7403555298;","Influences of postfire salvage logging on forest birds in the Eastern Cascades, Oregon, USA",2009,"Forest Ecology and Management","257","3",,"1119","1128",,23,"10.1016/j.foreco.2008.11.019","https://www.scopus.com/inward/record.uri?eid=2-s2.0-58149302673&doi=10.1016%2fj.foreco.2008.11.019&partnerID=40&md5=de72d5ef908e0bd5a6395b3a6d9aa4d0","Department of Forest Science, Oregon State University, Corvallis, OR 97331, United States","Cahall, R.E., Department of Forest Science, Oregon State University, Corvallis, OR 97331, United States; Hayes, J.P., Department of Forest Science, Oregon State University, Corvallis, OR 97331, United States","In coniferous forests of western North American, fire is an important disturbance that influences the structure and composition of floral and faunal communities. The impacts of postfire management, including salvage logging and replanting, on these forests are not well known. We compared densities and relative abundances of forest birds after fire in unsalvaged stands and stands subjected to one of two intensities of salvage logging (moderate, 30 snags retained per ha and heavy, 5-6 snags retained per ha) in mixed-conifer forests in central Oregon. We used analysis of variance with repeated measures to evaluate three hypotheses concerning the influence of different intensities of salvage on densities or relative abundances of sixteen species of birds, and two hypotheses concerning the influence of time since salvage logging on relative abundances or densities of birds. We also examined the relationship between vegetation and abundances of each bird species. We did not detect significant differences among treatments in densities or relative abundances for eight species and one genus of birds. We detected significant differences for seven species, though the patterns differed among species. Relative abundances or densities of the black-backed woodpecker (Picoides arcticus), hairy woodpecker (P. villosus), brown creeper (Certhia americana), western wood-pewee (Contopus sordidulus) and yellow-rumped warbler (Dendroica coronata) were lower in the heavy and moderate salvage treatment compared to the unsalvaged treatment, while densities of the dark-eyed junco (Junco hyemalis) and fox sparrow (Passerella iliaca) were greater in the moderately and heavily salvaged stands than in the unsalvaged treatment. We detected significant differences between years for four species of birds. Our findings suggest that both cavity-nesting and cup-nesting species respond to salvage logging, and that some species respond uniquely to habitat features influenced by salvage logging. For species that responded negatively to salvage logging, the moderate salvage intensity did not appear to mitigate the negative influence of salvage logging. Areas of unlogged burned forest appear to provide important habitat for some species of birds following forest fires. Our findings parallel those of other recent studies of these species, suggesting robust patterns that transcend particular locations. © 2008 Elsevier B.V. All rights reserved.","Birds; Fire; Ponderosa pine-Douglas-fir forest; Salvage logging",Article,"Final",,Scopus,2-s2.0-58149302673
"Wyshynski S.A., Nudds T.D.","36711013000;7003884396;","Pattern and process in forest bird communities on boreal landscapes originating from wildfire and timber harvest",2009,"Forestry Chronicle","85","2",,"218","226",,6,"10.5558/tfc85218-2","https://www.scopus.com/inward/record.uri?eid=2-s2.0-65649094762&doi=10.5558%2ftfc85218-2&partnerID=40&md5=7d3488fc0908c312739cf4206f5dc0d2","Department of Integrative Biology, University of Guelph, 50 Stone Road E., Guelph, ON N1G 2W1, Canada","Wyshynski, S.A., Department of Integrative Biology, University of Guelph, 50 Stone Road E., Guelph, ON N1G 2W1, Canada; Nudds, T.D., Department of Integrative Biology, University of Guelph, 50 Stone Road E., Guelph, ON N1G 2W1, Canada","Policy direction to emulate natural disturbance in managed boreal forests has spurred a need to contrast the dynamics of biota on landscapes originating from timber harvest and from wildfire (hereafter, ""managed"" and ""natural""). Typically, emphasis is on pattern emulation, and less on processes, such as competition, predation or habitat selection. Knowing how communities in the boreal forest assemble can provide further insight to the effects of anthropogenic disturbance on the processes responsible, permitting assessments about whether forestry practices emulate processes as well as patterns. We contrasted variation in species richness among forest types, with stand area, and between local (forest stand) and regional (landscape) scales on managed and natural boreal landscapes in NW Ontario. Species richness varied more among forest stand types than between landscapes, or with stand area, on either landscape. On both landscapes, mean local species richness was 1/3 of regional richness, consistent with the hypothesis that competition structured stand-level assemblages regardless of stand origin. We further compared the structure of stand-level assemblages from randomized null models using presence/absence and abundance data with observed assemblages on each landscape, while controlling for variation in habitat structure among stands. Local bird assemblages were over-dispersed in niche space relative to random assemblages, also consistent with the competition hypothesis, regardless of stand origin. We found no evidence that patterns of variation in diversity of songbirds and woodpeckers, nor the processes that govern them, differed between managed and natural boreal forest landscapes. Our results suggest that past forest practices in this region, if by default, nevertheless emulated natural patterns of variation in diversity and species assembly of bird communities.","Boreal forest; Community assembly; Forestry; Natural disturbance emulation; Null models; Ontario; Songbirds; Woodpeckers",Article,"Final",,Scopus,2-s2.0-65649094762
"Hanson C.T., North M.P.","12771955500;7102801074;","Postfire woodpecker foraging in salvage-logged and unlogged forests of the Sierra Nevada",2008,"Condor","110","4",,"777","782",,26,"10.1525/cond.2008.8611","https://www.scopus.com/inward/record.uri?eid=2-s2.0-67649669774&doi=10.1525%2fcond.2008.8611&partnerID=40&md5=3b2a656c6fb3bbd33e378110a6fc400e","Department of Plant Sciences, College of Agricultural and Environmental Sciences, University of California at Davis, One Shields Avenue, Davis, CA 95616, United States; USDA Forest Service, Pacific Southwest Research Station, Sierra Nevada Research Center, 1731 Research Park Dr., Davis, CA 95616, United States","Hanson, C.T., Department of Plant Sciences, College of Agricultural and Environmental Sciences, University of California at Davis, One Shields Avenue, Davis, CA 95616, United States; North, M.P., USDA Forest Service, Pacific Southwest Research Station, Sierra Nevada Research Center, 1731 Research Park Dr., Davis, CA 95616, United States","In forests, high-severity burn patches-wherein most or all of the trees are killed by fire-often occur within a mosaic of low- and moderate-severity effects. Although there have been several studies of postfire salvage-logging effects on bird species, there have been few studies of effects on bird species associated with high-severity patches in forests that have otherwise burned at lower severities. From 2004 to 2006, we investigated the foraging presence or absence of three woodpecker species, the Black-backed (Picoides arcticus), Hairy (P. villosus), and White-headed (P. albolarvatus) Woodpeckers, within four different forest habitat conditions in Sierra Nevada conifer forests: unburned; moderate-severity and unlogged; high-severity and unlogged; and high-severity and logged. We found Black-backed Woodpecker foraging was restricted to unlogged high-severity patches. Hairy Woodpeckers foraged most in unlogged high-severity patches, and White-headed Woodpeckers showed no significant difference in presence among conditions. These results suggest that unlogged, high-severity forest is important habitat for the Black-backed and Hairy Woodpeckers. © The Cooper Ornithological Society 2008.","Foraging; High-severity fire; Salvage logging; Sierra Nevada; Stand-replacement fire; Woodpeckers",Article,"Final",,Scopus,2-s2.0-67649669774
"Hutto R.L.","6603948267;","The ecological importance of severe wildfires: Some like it hot",2008,"Ecological Applications","18","8",,"1827","1834",,114,"10.1890/08-0895.1","https://www.scopus.com/inward/record.uri?eid=2-s2.0-63249085825&doi=10.1890%2f08-0895.1&partnerID=40&md5=aa8771b115c9a15f233f2b34e07e00ee","Avian Science Center, Division of Biological Sciences, University of Montana, Missoula, MT 59812, United States","Hutto, R.L., Avian Science Center, Division of Biological Sciences, University of Montana, Missoula, MT 59812, United States","Many scientists and forest land managers concur that past fire suppression, grazing, and timber harvesting practices have created unnatural and unhealthy conditions in the dry, ponderosa pine forests of the western United States. Specifically, such forests are said to carry higher fuel loads and experience fires that are more severe than those that occurred historically. It remains unclear, however, how far these generalizations can be extrapolated in time and space, and how well they apply to the more mesic ponderosa pine systems and to other forest systems within the western United States. I use data on the pattern of distribution of one bird species (Black-backed Woodpecker, Picoides arcticus) as derived from 16 465 sample locations to show that, in western Montana, this bird species is extremely specialized on severely burned forests. Such specialization has profound implications because it suggests that the severe fires we see burning in many forests in the Intermountain West are not entirely ""unnatural"" or ""unhealthy."" Instead, severely burned forest conditions have probably occurred naturally across a broad range of forest types for millennia. These findings highlight the fact that severe fire provides an important ecological backdrop for fire specialists like the Black-backed Woodpecker, and that the presence and importance of severe fire may be much broader than commonly appreciated. © 2008 by the Ecological Society of America.","Black-backed Woodpecker; Fire history; Fire regime; Mixed-conifer forest; Picoides arcticus; Severe fire",Article,"Final",,Scopus,2-s2.0-63249085825
